{
  "contract": "agentgov.distribution-input-manifest",
  "schema_version": "1.0",
  "authority": {
    "authorizes_build": false,
    "authorizes_git_write": false,
    "authorizes_journey": false,
    "authorizes_publication": false,
    "authorizes_release": false,
    "authorizes_deployment": false
  },
  "derivation": {
    "pyproject": "pyproject.toml",
    "fixed_metadata_inputs": [
      "LICENSE",
      "pyproject.toml"
    ],
    "package_inputs": "regular .py files below each tool.setuptools.packages.find.where root",
    "data_file_inputs": "regular files matched by tool.setuptools.data-files source patterns",
    "glob_semantics": "python-glob-nonrecursive-unless-double-star"
  },
  "supersession": {
    "supersedes": "exact-distribution-pathspec-replay-v1 omitted path list",
    "historical_observed_count": 199,
    "recovered_historical_paths": false,
    "reason": "This repository-owned current declaration supersedes the non-replayable observation; it does not reconstruct or identify the omitted historical paths."
  },
  "paths": [
    "LICENSE",
    "README.md",
    "agent-skills/README.md",
    "agent-skills/action-loop-stagnation/SKILL.md",
    "agent-skills/context-first-review/SKILL.md",
    "agent-skills/development-slice/SKILL.md",
    "agent-skills/incident-attribution/SKILL.md",
    "agent-skills/incident-response/SKILL.md",
    "agent-skills/reconcile-invariants/SKILL.md",
    "agent-skills/requirement-admission/SKILL.md",
    "evaluation/readiness-policy.md",
    "evaluation/schemas/evaluation-manifest.schema.json",
    "evaluation/schemas/failure-case.schema.json",
    "evaluation/schemas/golden-example.schema.json",
    "evaluation/schemas/seed-case.schema.json",
    "governance/capability-dependencies.schema.json",
    "governance/capability.schema.json",
    "governance/control-mapping.schema.json",
    "governance/inventory.schema.json",
    "pyproject.toml",
    "release/current.json",
    "schemas/active-agent-self-review-draft.schema.json",
    "schemas/active-agent-self-review-start.schema.json",
    "schemas/active-agent-self-review-stream-response.schema.json",
    "schemas/admission-route.schema.json",
    "schemas/admission-routing-policy.schema.json",
    "schemas/adoption-report.schema.json",
    "schemas/alignment-context.schema.json",
    "schemas/benefit-comparison.schema.json",
    "schemas/benefit-monitor.schema.json",
    "schemas/ci-integration-plan.schema.json",
    "schemas/clarification-dialogue.schema.json",
    "schemas/clarification-prompt.schema.json",
    "schemas/clarification-update.schema.json",
    "schemas/codex-hooks-integration-plan.schema.json",
    "schemas/codex-mcp-integration-plan.schema.json",
    "schemas/coding-agent-alignment-response.schema.json",
    "schemas/coding-agent-event.schema.json",
    "schemas/coding-agent-response.schema.json",
    "schemas/development-completion.schema.json",
    "schemas/development-context.schema.json",
    "schemas/development-event-export.schema.json",
    "schemas/development-evidence.schema.json",
    "schemas/development-monitor.schema.json",
    "schemas/development-scope-report.schema.json",
    "schemas/development-session.schema.json",
    "schemas/development-state.schema.json",
    "schemas/development-task.schema.json",
    "schemas/development-trigger.schema.json",
    "schemas/distribution-input-manifest.schema.json",
    "schemas/doctor-report.schema.json",
    "schemas/documentation-archive-plan.schema.json",
    "schemas/drift-review-policy.schema.json",
    "schemas/drift-review-record.schema.json",
    "schemas/drift-review-status.schema.json",
    "schemas/evidence-freshness.schema.json",
    "schemas/foreground-cycle.schema.json",
    "schemas/governance-event.schema.json",
    "schemas/harness-contract-v1.schema.json",
    "schemas/host-interaction-capabilities.schema.json",
    "schemas/host-interaction-request.schema.json",
    "schemas/human-decision-prompt.schema.json",
    "schemas/human-decision-result.schema.json",
    "schemas/interaction-card.schema.json",
    "schemas/learning-review.schema.json",
    "schemas/mcp-tool-error.schema.json",
    "schemas/next-action.schema.json",
    "schemas/onboarding-plan.schema.json",
    "schemas/refresh-plan.schema.json",
    "schemas/release-manifest.schema.json",
    "schemas/release-review-evidence-freshness-pilot.schema.json",
    "schemas/release-review.schema.json",
    "schemas/replay-claim-recovery-v1.schema.json",
    "schemas/replay-correlation-bridge-v1.schema.json",
    "schemas/replay-correlation-claim-v1.schema.json",
    "schemas/replay-correlation-reservation-v1.schema.json",
    "schemas/replay-preflight-v1.schema.json",
    "schemas/repository-contract.schema.json",
    "schemas/repository-report.schema.json",
    "schemas/semantic-review-provider-capabilities.schema.json",
    "schemas/semantic-review-result.schema.json",
    "schemas/semantic-review-route.schema.json",
    "schemas/status-report.schema.json",
    "schemas/task-admission-plan.schema.json",
    "schemas/task-proposal.schema.json",
    "schemas/update-check.schema.json",
    "schemas/upgrade-observation.schema.json",
    "schemas/upgrade-pr-plan.schema.json",
    "schemas/upgrade-pr-write.schema.json",
    "schemas/upgrade-review.schema.json",
    "schemas/work-request.schema.json",
    "src/agentgov/__init__.py",
    "src/agentgov/__main__.py",
    "src/agentgov/active_agent_self_review.py",
    "src/agentgov/admission_routing.py",
    "src/agentgov/adoption.py",
    "src/agentgov/agent_skills.py",
    "src/agentgov/alignment_transport.py",
    "src/agentgov/app_server_schema_diagnostic.py",
    "src/agentgov/artifacts.py",
    "src/agentgov/benefit_monitor.py",
    "src/agentgov/benefits.py",
    "src/agentgov/capability.py",
    "src/agentgov/change_scope.py",
    "src/agentgov/clarification_dialogue.py",
    "src/agentgov/cli.py",
    "src/agentgov/codex_hooks.py",
    "src/agentgov/codex_mcp.py",
    "src/agentgov/coding_agent_transport.py",
    "src/agentgov/consumer_ci.py",
    "src/agentgov/controls.py",
    "src/agentgov/dependencies.py",
    "src/agentgov/development_context.py",
    "src/agentgov/development_event_export.py",
    "src/agentgov/development_evidence.py",
    "src/agentgov/development_handoff.py",
    "src/agentgov/development_monitor.py",
    "src/agentgov/development_session.py",
    "src/agentgov/development_state.py",
    "src/agentgov/development_trigger.py",
    "src/agentgov/doctor.py",
    "src/agentgov/documentation_archive.py",
    "src/agentgov/drift_review.py",
    "src/agentgov/evaluation.py",
    "src/agentgov/event_store.py",
    "src/agentgov/evidence_freshness.py",
    "src/agentgov/foreground_coordinator.py",
    "src/agentgov/git_snapshot.py",
    "src/agentgov/governance_mcp.py",
    "src/agentgov/harness_contract.py",
    "src/agentgov/host_interaction.py",
    "src/agentgov/html_reporting.py",
    "src/agentgov/human_decision.py",
    "src/agentgov/initializer.py",
    "src/agentgov/installed_schema_validation.py",
    "src/agentgov/inventory.py",
    "src/agentgov/learning_review.py",
    "src/agentgov/next_action.py",
    "src/agentgov/onboarding.py",
    "src/agentgov/path_policy.py",
    "src/agentgov/process_attribution_gate.py",
    "src/agentgov/redaction.py",
    "src/agentgov/reference_adapter.py",
    "src/agentgov/reference_alignment_adapter.py",
    "src/agentgov/reference_task_proposal_adapter.py",
    "src/agentgov/references.py",
    "src/agentgov/refresh.py",
    "src/agentgov/release_metadata.py",
    "src/agentgov/release_review.py",
    "src/agentgov/replay_claim.py",
    "src/agentgov/replay_claim_recovery.py",
    "src/agentgov/replay_correlation_bridge.py",
    "src/agentgov/replay_preflight.py",
    "src/agentgov/replay_reservation.py",
    "src/agentgov/reporting.py",
    "src/agentgov/repository.py",
    "src/agentgov/self_review_transport.py",
    "src/agentgov/semantic_review.py",
    "src/agentgov/software_update.py",
    "src/agentgov/status.py",
    "src/agentgov/task_contract.py",
    "src/agentgov/task_proposal.py",
    "src/agentgov/task_start_scope_baseline.py",
    "src/agentgov/update_check.py",
    "src/agentgov/upgrade_pr.py",
    "src/agentgov/upgrade_review.py",
    "src/agentgov/upgrade_writer.py",
    "src/agentgov/windows_process_observer.py",
    "templates/ADR.template.md",
    "templates/AGENTS.template.md",
    "templates/INVARIANTS.template.md",
    "templates/admission-routing-policy.template.json",
    "templates/capability-dependencies.template.json",
    "templates/codex-hooks.template.json",
    "templates/control-mapping.template.json",
    "templates/development-task.template.json",
    "templates/drift-review-policy.template.json",
    "templates/evaluation-manifest.template.json",
    "templates/example-capability.input.schema.template.json",
    "templates/example-capability.output.schema.template.json",
    "templates/governance-inventory.template.json",
    "templates/prompt-capability.template.json",
    "templates/prompt-source.template.md",
    "templates/repository-contract.template.json",
    "templates/task-proposal.template.json",
    "templates/tasks.keep",
    "templates/work-request.template.json"
  ],
  "path_digest": "sha256:79839fec9be5dfb8bb30c41e74a0d8a9a6a11b3587001af6395f7f1b7c506e9a",
  "content_digest": "sha256:a695fb5afcaadcc2f3382a7a878d4e182070539d61b5e39a0ea663b00874a96c"
}
